{
  "$schema": "../deslint-report.schema.json",
  "schemaVersion": 1,
  "status": "pass",
  "definitionId": "example-product",
  "fingerprintSha256": "1111111111111111111111111111111111111111111111111111111111111111",
  "ruleSet": {
    "fingerprintSha256": "2222222222222222222222222222222222222222222222222222222222222222",
    "packs": [
      {
        "id": "ansldes-core",
        "version": "1.0.0",
        "fingerprintSha256": "3333333333333333333333333333333333333333333333333333333333333333"
      }
    ],
    "rules": [{ "ruleId": "source/raw-value", "status": "active" }]
  },
  "evidence": [
    { "kind": "native-source", "platform": "react-native", "status": "pass" }
  ],
  "summary": {
    "errors": 0,
    "warnings": 0,
    "raw": 0,
    "overflow": 0,
    "overlap": 0,
    "falsePositives": 0
  },
  "diagnostics": [],
  "falsePositives": [],
  "visualJudgments": [],
  "stageExecutions": []
}
